<?xml version="1.0" encoding="UTF-8"?>
<!DOCTYPE relacion SYSTEM "ejercicio7.dtd">
<relacion>
  <persona carnet="hijo" sexo="hombre">
   <nombre>Alvaro</nombre>
   <email></email>
   <parentesco tutor-legal="hija" hermano-a="madre" />
  </persona>
  <persona carnet="hija" sexo="mujer">
   <nombre>Antonia</nombre>
   <email></email>
   <parentesco tutor-legal="hijo" hermano-a="hijo" />
  </persona>
  <persona carnet="madre" sexo="mujer">
   <nombre>Lola</nombre>
   <email></email>
   <parentesco tutor-legal="hijo" hermano-a="hijo madre"/>
  </persona>
</relacion>

